{
  "version": 1,
  "description": "キャラ・武器のレベル目盛り間必要 EXP。正本は本 JSON。同期時に LevelExpSegments へ書き込む。",
  "levelMarks": [1, 20, 30, 40, 50, 60, 70, 80, 90],
  "characterExp": {
    "1-20": 12275,
    "20-30": 57900,
    "30-40": 65700,
    "40-50": 39300,
    "50-60": 94800,
    "60-70": 114300,
    "70-80": 280800,
    "80-90": 393750
  },
  "weaponExpByRarity": {
    "3": {
      "1-20": 53475,
      "20-30": 127978,
      "30-40": 145247,
      "40-50": 275350,
      "50-60": 408650,
      "60-70": 572725,
      "70-80": 772825,
      "80-90": 1638650
    },
    "4": {
      "1-20": 81000,
      "20-30": 194512,
      "30-40": 220613,
      "40-50": 418725,
      "50-60": 618400,
      "60-70": 866675,
      "70-80": 1168350,
      "80-90": 2476475
    },
    "5": {
      "1-20": 121550,
      "20-30": 291591,
      "30-40": 331209,
      "40-50": 628150,
      "50-60": 927675,
      "60-70": 1299125,
      "70-80": 1750375,
      "80-90": 3714775
    }
  }
}
